{
  "id": "balanced_reaction",
  "category": "reaction",
  "title": { "ja": "反応品質バランス達成", "en": "Reaction Quality Balance" },
  "description": {
  "ja": "定着率7日80%以上を保ちつつ 反応中央値12%以上改善 または 反応ばらつき指数1.40以下 を達成",
  "en": "With 7-day retention ≥80%, achieved either ≥12% median improvement or variability index ≤1.40"
  },
  "conditions": [
    { "type": "retention_rate", "op": ">=", "value": 80 }
  ],
  "anyOf": [
    [ { "type": "reaction_p50_improve", "op": ">=", "value": 0.12 } ],
    [ { "type": "tail_index_low", "op": "<=", "value": 1.40 } ]
  ],
  "tier": 1,
  "repeatable": false,
  "version": 1,
  "tags": ["reaction", "hybrid", "anyOf"]
}
