{
  "id": "tail_index_low",
  "category": "reaction",
  "title": { "ja": "反応ばらつき指数1.35以下", "en": "Low Reaction Variability" },
  "description": {
  "ja": "直近7日の反応ばらつき指数(p90/中央値)を1.35以下に維持",
  "en": "Kept the 7-day reaction variability index (p90/median) at 1.35 or lower"
  },
  "conditions": [
    { "type": "tail_index_low", "op": "<=", "value": 1.35 }
  ],
  "tier": 1,
  "repeatable": false,
  "version": 1,
  "tags": ["reaction", "consistency"]
}
