{
  "id": "reaction_p50_improve",
  "category": "reaction",
  "title": { "ja": "反応中央値15%改善", "en": "15% Faster Median Reaction" },
  "description": {
  "ja": "直近7日の反応時間中央値を過去平均より15%以上短縮した",
  "en": "7-day median reaction time improved by 15% vs prior average"
  },
  "conditions": [
    { "type": "reaction_p50_improve", "op": ">=", "value": 0.15 }
  ],
  "tier": 1,
  "repeatable": false,
  "version": 1,
  "tags": ["reaction", "performance"]
}
